[
  {
    "chunk_id": "7a533657-6152-400e-a7fb-c12759a7b53e",
    "paper_id": "06_2013_brosseau_trf",
    "section": "body",
    "page_start": 1,
    "page_end": 11,
    "text": "Modeling pedestrians\u0001 road crossing behavior in traﬃc\nsystem micro-simulation in China\nJianguo Yang *, Wen Deng, Jinmei Wang, Qingfeng Li, Zhaoan Wang\nSchool of Electrical Engineering, Xi’an Jiaotong University, Xi’an 710049, China\nAbstract\nIn many Chinese cities, pedestrian\u0001s road crossing behavior is diﬀerent from that of pedestrians in developed countries.\nThis paper presents a pedestrian model for traﬃc system micro-simulation in China. Considering the high rate of signal\nnon-compliance, we classify pedestrians into two types: law-obeying ones and opportunistic ones. Opportunistic ones\ndecide whether to violate traﬃc signal during red man, depending on the states of some external factors (like policeman,\nvehicle ﬂow and other pedestrians\u0001 behaviors). Questionnaires were used to determine the proportions of these two types of\npedestrians under diﬀerent circumstances. In addition, a time gap distribution extracted from videotape were used to deter-\nmine the criterion for pedestrians to decide whether to walk or wait when they conﬂict with vehicle ﬂows. However, sim-\nulation results deviate from the data extracted from videotape in some degree. By adjusting the parameters on the b",
    "char_start": 0,
    "char_end": 1200,
    "order_index": 0
  },
  {
    "chunk_id": "5cfdcd4c-4dbc-4fe5-b91d-25d4aca2fc15",
    "paper_id": "06_2013_brosseau_trf",
    "section": "body",
    "page_start": 1,
    "page_end": 11,
    "text": "asis of\nanalyzing the occurrence of the deviations, the simulation results agree with the ﬁeld results better. This model has repre-\nsented the high rate of pedestrians\u0001 red light running and the mixed characteristics of traﬃc ﬂows in Chinese cities, and it\nmay be applicable in the micro-simulation of traﬃc system in other developing cities.\n\u0001 2005 Elsevier Ltd. All rights reserved.\nKeywords: Microscopic simulation; Modelling; Pedestrian; Traﬃc violation\n1. Introduction\nTraﬃc simulation has been widely used to evaluate control scenarios in recent years. Pedestrian is a so\nimportant entity in traﬃc ﬂows that it could not be ignored when we lay a managing course. Nowadays, a\nnumber of studies have been conducted on pedestrian simulation.\nAs for the microscopic aspect, several kinds of simulation model have been developed widely. Beneﬁt Cost\nCellular Model, Magnetic Force Model, and Social Force Model have been developed for a period of time.\nThese models mainly concern explanation of the phenomena of pedestrians\u0001 queuing, way ﬁnding and self-\norganization (Teknomo et al., 2000). In addition, cellular automata model has been introduced to provide\na microscopic description of pedestria",
    "char_start": 1200,
    "char_end": 2400,
    "order_index": 1
  },
  {
    "chunk_id": "f2a8c8f5-74ff-4904-b2f2-0f354655d1e1",
    "paper_id": "06_2013_brosseau_trf",
    "section": "body",
    "page_start": 1,
    "page_end": 11,
    "text": "ns. For instance, bi-directional pedestrian movement was modeled based\non cellular automata by Blue and Adler (2001) and Fang et al. (2003).\n0965-8564/$ - see front matter \u0001 2005 Elsevier Ltd. All rights reserved.\ndoi:10.1016/j.tra.2005.08.001\n* Corresponding author. Tel.: +86 29 8266 8630 309.\nE-mail address: yjg@mail.xjtu.edu.cn (J. Yang).\nTransportation Research Part A 40 (2006) 280–290\nwww.elsevier.com/locate/tra",
    "char_start": 2400,
    "char_end": 2820,
    "order_index": 2
  },
  {
    "chunk_id": "b0a51e5b-995b-4934-84e1-0587f5ea854a",
    "paper_id": "06_2013_brosseau_trf",
    "section": "body",
    "page_start": 1,
    "page_end": 11,
    "text": "However, little information has been published concerning micro-simulation of pedestrians\u0001 signal non-\ncompliance decision when they are crossing road. Researches on pedestrians\u0001 violation mainly focus on soci-\nology and psychology to ﬁnd out which situational factors could have inﬂuence on pedestrians, and whether it\nwould be diﬀerent with diﬀerent age or gender.\nA questionnaire was distributed to 205 Israeli college students. Respondents were asked to answer how the\npresence of a certain factor, like traﬃc volume, weather, other pedestrians\u0001 violation, would aﬀect their behav-\niors as crossings with a \u0002don\u0001t walk\u0001 sign (Yagil, 2000). Hamed (2001) paid attention to the divided streets (with\nrefuge island). Impact of the pedestrian waiting countdown timer on pedestrian behavior was also studied\n(Keegan and Mahony, 2003).\nLiu et al. (2000) developed a micro-simulation tool for assessing pedestrian delays and traﬃc management.\nThey classiﬁed pedestrians into two types: ‘‘law-obeying’’ ones and ‘‘opportunistic’’ ones. But proportion of\neach type was simply predetermined before simulation, not depended on the decision results of \u0002pedestrians\u0001\nand varies along with the traﬃc conditions.",
    "char_start": 0,
    "char_end": 1200,
    "order_index": 3
  },
  {
    "chunk_id": "e479580f-f93b-4495-832a-8b9b6c67ca12",
    "paper_id": "06_2013_brosseau_trf",
    "section": "body",
    "page_start": 1,
    "page_end": 11,
    "text": "\nAs a developing country, China has her own traﬃc characteristics. Researches show the proportion of\nwalking in the total egression comes to 40% in big cities in China, and it must be higher in smaller cities or\nin towns. Owing to the weakness of safety consciousness and misgoverning, pedestrians\u0001 violation in China\nis popular. Report on the Investigation of Pedestrians\u0001 Road-crossing Behavior in the Main Road of\nGuangzhou in 2003 shows, in average, 23.3% of pedestrians took an illegal action while crossing streets,\nand the rate came to 66.7% in certain sections. Most pedestrians always turn a blind eye to the traﬃc lights.\nConsequently, the road is often under the situation that vehicles and pedestrians being inﬂuenced by each\nother and the mixed traﬃc ﬂow has been a typical feature of the Chinese city traﬃc.\nDue to the special features of Chinese city traﬃc, application of the micro-simulation tools developed by\nforeign countries in China has not obtained obvious eﬀect. He (2003) once studied the applicability of COR-\nSIM and SIMTRAFFIC for signalized intersections in Beijing, China, results show that their vehicle models\ncan achieve favorable eﬀect, but the pedestrian and bicycl",
    "char_start": 1200,
    "char_end": 2400,
    "order_index": 4
  },
  {
    "chunk_id": "1ea68fac-f5d1-4350-9282-64b662702c40",
    "paper_id": "06_2013_brosseau_trf",
    "section": "body",
    "page_start": 1,
    "page_end": 11,
    "text": "e models could not truly describe the situations at\nintersections. Modeling of pedestrians\u0001 behavior and its impact on traﬃc ﬂow is a key point need to be solved\nin the ﬁeld of traﬃc system micro-simulation in our country.\nSome researchers in China have realized this particularity, and correlative work is being done, but it still\nneeds a long way to go. Zhang et al. (2004) used cellular automata to derive a two-dimensional model for sim-\nulation of pedestrian\u0001s crossing dynamics. Simulation of a crosswalk without signal was carried out. Interac-\ntions between pedestrians and vehicles were described in some degree, but pedestrians\u0001 ﬁghting for right of way\nwith vehicle drivers has not been fully presented. Gao et al. (2004) regarded pedestrians as a disturbance to\nvehicle ﬂows. They observed a pedestrians\u0001 crossing point in the city of Wuhan and brought forward a pedes-\ntrians\u0001 disturbance model for traﬃc micro-simulation based on Poisson distribution. Parameters were cali-\nbrated by ﬁeld data. However, pedestrians\u0001 crossing choices are seriously impacted by the current traﬃc\nconditions, especially the vehicle gaps. Gao et al. have not taken these factors into consideration.\nIn simu",
    "char_start": 2400,
    "char_end": 3600,
    "order_index": 5
  },
  {
    "chunk_id": "dd432c83-fe14-4723-9765-bc7e31fa3f28",
    "paper_id": "06_2013_brosseau_trf",
    "section": "body",
    "page_start": 1,
    "page_end": 11,
    "text": "lation, it is an important thing to let the \u0002pedestrian\u0001 know how to pass through the vehicle ﬂow\nsafely after their violation decisions. Many researchers have done investigations on this problem. In general,\nGap Acceptance is widely used as the judging criterion of pedestrians\u0001 safety crossing. Each pedestrian is sup-\nposed to have a critical gap, which is calculated by this equation (Wan and Rouphail, 2004)\nCG ¼ L\nS þ F\nð1Þ\nwhere L is the crosswalk length, S is the pedestrian\u0001s average walking speed. F is a safety factor reﬂects pedes-\ntrian aggressiveness. Pedestrians will do comparison between the vehicle gaps and the critical gap. The gap,\nwhich is smaller than the critical gap, will be rejected. In 1991, Hunt and Griﬃths took two-direction vehicle\nﬂows into account and gave probability matrices for rejection of crossing opportunities for 10.0 m wide roads\n(Lyons et al., 2001).\nAppearance of the traﬃc jam in rush hours and the increase of accident rate have a strong relation to the\nparticipators\u0001 non-compliance. In order to truly reappear the traﬃc condition of the signalized intersections in\nChina, it is necessary to develop a model basing on human behavior for simulating ped",
    "char_start": 3600,
    "char_end": 4800,
    "order_index": 6
  },
  {
    "chunk_id": "bdb7b3e8-ce76-41ff-ba01-54acc1c1f1a4",
    "paper_id": "06_2013_brosseau_trf",
    "section": "body",
    "page_start": 1,
    "page_end": 11,
    "text": "estrians\u0001 red light\nrunning when crossing roads.\nJ. Yang et al. / Transportation Research Part A 40 (2006) 280–290\n281",
    "char_start": 4800,
    "char_end": 4918,
    "order_index": 7
  },
  {